Welche Risiken hat ein Taxi- oder Mietwagenunternehmer besonders zu bedenken?,Alle Unternehmer deren Firma in das Handelsregister eingetragen is,aus der Beförderung von Personen resultierenden hohen finanziellen persönlichen und strafrechtlichen Risiken,• hohe Kapital- und Personalintensität,• Konjunkturlage und öffentliche Wettbewerb,• Einengung unternehmerischer Tätigkeit durch gesetzliche Beschränkungen.,Der Scheck,Fahrzeuge Gebäude Betriebsausstattung Grundstücke usw.,• das Betriebsvermögen
Welche wettbewerbsrechtlichen Vorschriften hat der Unternehmer zu beachten?,• Gesetz gegen unlauteren Wettbewerb (UWG),• Gesetz gegen Wettbewerbsbeschränkungen.,Wiedergaben der abgesandten Handelsbriefe,• Körperschaftsteuer nicht zu entrichten,Nein,Ja er haftet aus Gefährdungshaftung nach StVO und aus unerlaubter Handlung.,Genauso wenn er selbst gefahren wäre.,Fahrzeuge Gebäude Betriebsausstattung Grundstücke usw.
Was bezweckt das Gesetz gegen den unlauteren Wettbewerb (UWG)?,Kredit ist ein Darlehen oder einen Zahlungsaufschub (Stundung).,Die guten Sitten im geschäftlichen Verkehr zu wahren. Unlauter ist Wettbewerb zum Beispiel wenn,• er auf täuschenden oder irreführenden Angaben beruht,• durch ihn psychologischer Kaufzwang ausgeübt wird,• er zur Geschäftsverletzung durch Anschwärzung von Mitkonkurrenten führt,• Angestellte und sonstiges Personal bestochen werden,• gewerberechtliche Vorschriften verletzt werden.,Genauso wenn er selbst gefahren wäre.
Welche Handlungsweise eines TUnternehmers stellt z.B. einen Verstoß gegen das UWG dar?,Das Kassieren geringeres Entgeltes als es geltende Taxitarifordnung vorsieht.,Stammkapital muss 25.000 € betragen,• das Betriebsvermögen,• Aufnahme von Krediten Darlehn oder Hypotheken,der Gewinn,Stammkapital muss 25.000 € betragen,der Gewinn,unerlaubter Handlung
Welche Ansprüche stehen dem Unternehmer bei Handlungen von Konkurrenten zu die gegen die Vorschriften des UWG verstoßen?,•Eigentumsvorbehalt - der Käufer bleibt so lange,Der Geschädigte hat einen Anspruch auf Unterlassung und Schadensersatz.,Fahrzeuge Gebäude Betriebsausstattung Grundstücke usw.,mbH bedeutet “mit beschränkter Haftung“,Kasse Bank Vorräte offene Forderungen Besitzwechsel usw.,Alle Unternehmer deren Firma in das Handelsregister eingetragen is,Kasse Bank Vorräte offene Forderungen Besitzwechsel usw.,• das Betriebsvermögen
regelmäßige Verjährungsfrist und wann beginnt diese zu laufen?,• Körperschaftsteuer nicht zu entrichten,• die regelmäßige Verjährungsfrist beträgt 3 Jahre,• sie beginnt mit dem Schluss des Jahres in dem der Anspruch entstanden ist.,Nein,• Jeder Geschäftsfähige jeder für geschäftsfähig Erklärte;,Die Fähigkeit allen Zahlungsverpflichtungen fristgerecht nachzukommen.,• Jeder Geschäftsfähige jeder für geschäftsfähig Erklärte;,Fahrzeuge Gebäude Betriebsausstattung Grundstücke usw.
Wie haftet ein Taxi- oder Mietwagenunternehmer für Schäden die ein Fahrgast während der Fahrt erleidet?,Ein ungesicherter Kredit der im Vertrauen auf die Person des Schuldners gegeben wird.,Kredit ist ein Darlehen oder einen Zahlungsaufschub (Stundung).,Die Haftung des Taxi- und Mietwagenunternehmer kann sich ergeben aus,Bargeldlose Zahlung erfolgt durch Scheck Wechsel Überweisung oder im Lastschriftverfahren,Beförderungsvertrag,unerlaubter Handlung,• Gefährdungshaftung nach Straßenverkehrsgesetz.,Genauso wenn er selbst gefahren wäre.
Wie haftet der Unternehmer aus dem Beförderungsvertrag?,Kommt der Fahrgast aufgrund von Verschulden des Unternehmers oder seines Fahrers zu Schaden so kann er Schadensersatz verlangen.,• Abtretung von Forderungen,• das Betriebsvermögen,• Aufnahme von Krediten Darlehn oder Hypotheken,der Gewinn,Stammkapital muss 25.000 € betragen,der Gewinn,der Gewinn
Wie haftet der Unternehmer ausunerlaubter Handlung?,Der Scheck,Der Fahrgast kann bei vorsätzlicher oder fahrlässiger Ver,Fahrzeuge Gebäude Betriebsausstattung Grundstücke usw.,mbH bedeutet “mit beschränkter Haftung“,Kasse Bank Vorräte offene Forderungen Besitzwechsel usw.,Alle Unternehmer deren Firma in das Handelsregister eingetragen is,Kasse Bank Vorräte offene Forderungen Besitzwechsel usw.,Kasse Bank Vorräte offene Forderungen Besitzwechsel usw.
Wie haftet der Unternehmer nach der Gefährdungshaftung?,Ja er haftet aus Gefährdungshaftung nach StVO und aus unerlaubter Handlung.,Der Schaden muss beim Betrieb des Kfz entstanden sein. Der Unternehmer ist nur dann nicht schadensersatzpflichtig wenn der Unfall auf unabwendbarem Ereignis beruht.,Genauso wenn er selbst gefahren wäre.,Nein,• Jeder Geschäftsfähige jeder für geschäftsfähig Erklärte;,Die Fähigkeit allen Zahlungsverpflichtungen fristgerecht nachzukommen.,• Jeder Geschäftsfähige jeder für geschäftsfähig Erklärte;,• Jeder Geschäftsfähige jeder für geschäftsfähig Erklärte;
Kann der Unternehmer seine Haftpflicht für Sachschäden begrenzen?,letzung von Leben Gesundheit Eigentum oder sonstigen Rechts vom Unternehmer Schadensersatz verlangen,Durch Sicherungsübereignung des eigenen Fahrzeugs an eine Bank oder ein sonstiges Finanzierungsinstitut.,Für Sachenschäden die der Fahrgast hat kann der Unternehmer die Schadensersatzpflicht auf 1.000 € pro beförderte Person beschränken.,Bargeldlose Zahlung erfolgt durch Scheck Wechsel Überweisung oder im Lastschriftverfahren,sie beginnt mit dem Schluss des Jahres in dem der Anspruch entstanden ist,Kredit ist ein Darlehen oder einen Zahlungsaufschub (Stundung).,sie beginnt mit dem Schluss des Jahres in dem der Anspruch entstanden ist,sie beginnt mit dem Schluss des Jahres in dem der Anspruch entstanden ist
Gilt diese Möglichkeit der Beschränkung der Haftpflicht für Sachschäden auch dann wenn der Unternehmer den Schaden grob fahrlässig verursacht hat?,Stammkapital muss 25.000 € betragen,Nein wenn der Schaden auf Vorsatz oder grober Fahrlässigkeit beruht kann die Haftung nicht ausgeschlossen werden.,• Abtretung von Forderungen,• sich eines Bürgen zu bedienen.,• Aufnahme von Krediten Darlehn oder Hypotheken,Betriebsausgaben,• das Betriebsvermögen,• das Betriebsvermögen
Ist eine Beschränkung auch der Personenschäden möglich?,Alle Unternehmer deren Firma in das Handelsregister eingetragen is,Ein- und Ausgabebuchführung.,• Journal - Aufzeichnung sämtlicher Geschäftsvorfälle.,Nein,mbH bedeutet “mit beschränkter Haftung“,Der Scheck,Fahrzeuge Gebäude Betriebsausstattung Grundstücke usw.,Fahrzeuge Gebäude Betriebsausstattung Grundstücke usw.
Haftet ein Taxi- und Mietwagenunternehmer auch für Schäden die dritte Personen insbesondere andere Verkehrsteilnehmer erleiden?,Die Fähigkeit allen Zahlungsverpflichtungen fristgerecht nachzukommen.,im Interesse der Besteuerung zu erfüllen,Ja er haftet aus Gefährdungshaftung nach StVO und aus unerlaubter Handlung,• Körperschaftsteuer nicht zu entrichten,Nein,Ja er haftet aus Gefährdungshaftung nach StVO und aus unerlaubter Handlung.,Genauso wenn er selbst gefahren wäre.,Genauso wenn er selbst gefahren wäre.
Muss man sich gegen diese Schäden versichern?,Kredit ist ein Darlehen oder einen Zahlungsaufschub (Stundung).,Bei der Anschaffung von neuen Fahrzeugen. (Finanzierung).,Ja der Halter muss nach dem Pflichtversicherungsgesetz eine Haftpflichtversicherung abschließen,Ein ungesicherter Kredit der im Vertrauen auf die Person des Schuldners gegeben wird.,Bargeldlose Zahlung erfolgt durch Scheck Wechsel Überweisung oder im Lastschriftverfahren,letzung von Leben Gesundheit Eigentum oder sonstigen Rechts vom Unternehmer Schadensersatz verlangen,unerlaubter Handlung,unerlaubter Handlung
Wie haftet ein Taxi- und Mietwagenunternehmer wenn ein von ihm beauftragter Fahrer einen Schaden verursacht?,• sich eines Bürgen zu bedienen.,Genauso wenn er selbst gefahren wäre.,• das Betriebsvermögen,• Aufnahme von Krediten Darlehn oder Hypotheken,der Gewinn,Stammkapital muss 25.000 € betragen,der Gewinn,• das Betriebsvermögen
Welche Möglichkeiten der Rechnungsbegleichung gibt es?,• Aufrechnung mit einer Gegenforderung.,• Zahlung per Kreditkarte oder mittels Electronic Cash,• Bargeldlose Zahlung erfolgt durch Scheck Wechsel Überweisung oder im Lastschriftverfahren,• Barzahlung die auch durch Barscheck erfolgen kann,Kasse Bank Vorräte offene Forderungen Besitzwechsel usw.,Alle Unternehmer deren Firma in das Handelsregister eingetragen is,Kasse Bank Vorräte offene Forderungen Besitzwechsel usw.,Fahrzeuge Gebäude Betriebsausstattung Grundstücke usw.
Was versteht man unter einer Nachnahme?,• Körperschaftsteuer nicht zu entrichten,Die Fähigkeit allen Zahlungsverpflichtungen fristgerecht nachzukommen.,Genauso wenn er selbst gefahren wäre.,Wenn eine Sache nur gegen vorherige Bezahlung des Nachnahmebetrages durch den Empfänger an ihn ausgeliefert werden darf,• Jeder Geschäftsfähige jeder für geschäftsfähig Erklärte;,Die Fähigkeit allen Zahlungsverpflichtungen fristgerecht nachzukommen.,• Jeder Geschäftsfähige jeder für geschäftsfähig Erklärte;,Genauso wenn er selbst gefahren wäre.
Was ist ein Scheck?,Ein ungesicherter Kredit der im Vertrauen auf die Person des Schuldners gegeben wird.,Kredit ist ein Darlehen oder einen Zahlungsaufschub (Stundung).,Ein Scheck ist schriftliche Zahlungsanweisung mit der der Aussteller seine Bank anweist von seinem Konto den Scheckbetrag dem Inhaber auszuzahlen.,Bargeldlose Zahlung erfolgt durch Scheck Wechsel Überweisung oder im Lastschriftverfahren,sie beginnt mit dem Schluss des Jahres in dem der Anspruch entstanden ist,Kredit ist ein Darlehen oder einen Zahlungsaufschub (Stundung).,sie beginnt mit dem Schluss des Jahres in dem der Anspruch entstanden ist,der Gewinn
Welche Scheckart gilt als besonders sicher und welchen Besonderheiten sind bei dieser Scheckart zu beachten?,Betriebsausgaben,Der Verrechnungsscheck weil keine Barauszahlung erfolgt sondern nur eine Verrechnung zwischen 2 Konten somit ist der Weg des Geldes nachvollziehbar,• das Betriebsvermögen,• Aufnahme von Krediten Darlehn oder Hypotheken,der Gewinn,Stammkapital muss 25.000 € betragen,der Gewinn,Kasse Bank Vorräte offene Forderungen Besitzwechsel usw.
Was macht aus einem Barscheck einen Verrechnungsscheck?,Der Scheck,Im Barscheck schreibt man einfach oben “Nur zur Verrechnung“.,Fahrzeuge Gebäude Betriebsausstattung Grundstücke usw.,mbH bedeutet “mit beschränkter Haftung“,Kasse Bank Vorräte offene Forderungen Besitzwechsel usw.,Alle Unternehmer deren Firma in das Handelsregister eingetragen is,Kasse Bank Vorräte offene Forderungen Besitzwechsel usw.,• Jeder Geschäftsfähige jeder für geschäftsfähig Erklärte;
Was ist ein Wechsel?,Ja er haftet aus Gefährdungshaftung nach StVO und aus unerlaubter Handlung.,Wiedergaben der abgesandten Handelsbriefe,Ein schriftliches Zahlungsversprechen mit der der Bezogene angewiesen wird zu einem bestimmten Zeitpunkt den Wechselbetrag einzulösen.,Nein,• Jeder Geschäftsfähige jeder für geschäftsfähig Erklärte;,Die Fähigkeit allen Zahlungsverpflichtungen fristgerecht nachzukommen.,• Jeder Geschäftsfähige jeder für geschäftsfähig Erklärte;,sie beginnt mit dem Schluss des Jahres in dem der Anspruch entstanden ist
Was ist der Unterschied zwischen Scheck und Wechsel?,letzung von Leben Gesundheit Eigentum oder sonstigen Rechts vom Unternehmer Schadensersatz verlangen,Der Scheck ist ein Zahlungsmittel.,unerlaubter Handlung,Der Wechsel ein Zahlungsversprechen.,sie beginnt mit dem Schluss des Jahres in dem der Anspruch entstanden ist,Kredit ist ein Darlehen oder einen Zahlungsaufschub (Stundung).,sie beginnt mit dem Schluss des Jahres in dem der Anspruch entstanden ist,• das Betriebsvermögen
Wer darf einen Wechsel ausstellen?,• Jeder Geschäftsfähige jeder für geschäftsfähig Erklärte;,• Minderjährige mit Zustimmung des gesetzlich. Vertreters,• Abtretung von Forderungen,• sich eines Bürgen zu bedienen.,• Aufnahme von Krediten Darlehn oder Hypotheken,Betriebsausgaben,• das Betriebsvermögen,Fahrzeuge Gebäude Betriebsausstattung Grundstücke usw.
Unter welchen Umständen sollte man einen Wechsel unterschreiben?,Alle Unternehmer deren Firma in das Handelsregister eingetragen is,Ein- und Ausgabebuchführung.,• Journal - Aufzeichnung sämtlicher Geschäftsvorfälle.,•Eigentumsvorbehalt - der Käufer bleibt so lange,Nur dann wenn es die Geschäftslage bei genauer Überprüfung unbedingt erfordert und die spätere Einlösung auf jeden Fall gewährleistet ist.,Der Scheck,Fahrzeuge Gebäude Betriebsausstattung Grundstücke usw.,Genauso wenn er selbst gefahren wäre.
Wann ist man aus einem Wechsel verpflichtet?,Die Fähigkeit allen Zahlungsverpflichtungen fristgerecht nachzukommen.,Wenn man unterschrieben hat gleichgültig ob als Aussteller Bezogener Indossant oder als Wechselb,Wiedergaben der abgesandten Handelsbriefe,• Körperschaftsteuer nicht zu entrichten,Nein,Ja er haftet aus Gefährdungshaftung nach StVO und aus unerlaubter Handlung.,Genauso wenn er selbst gefahren wäre.,unerlaubter Handlung
Welchem Zweck dient der Wechsel hauptsächlich?,Kredit ist ein Darlehen oder einen Zahlungsaufschub (Stundung).,Bei der Anschaffung von neuen Fahrzeugen. (Finanzierung).,Durch Sicherungsübereignung des eigenen Fahrzeugs an eine Bank oder ein sonstiges Finanzierungsinstitut.,Ein ungesicherter Kredit der im Vertrauen auf die Person des Schuldners gegeben wird.,Ein Wechsel dient der Sicherung von gegebenen Krediten.,letzung von Leben Gesundheit Eigentum oder sonstigen Rechts vom Unternehmer Schadensersatz verlangen,unerlaubter Handlung,• das Betriebsvermögen
Warum werden Kredite durch Wechsel gesichert?,• sich eines Bürgen zu bedienen.,Der Gläubiger kann im Falle gerichtlicher Beitreibung den Schuldner im Wechselprozess verklagen der in kurzer Zeit durchzuführen ist und nur wenige und eng begrenzte Einwände zulässt.,• das Betriebsvermögen,• Aufnahme von Krediten Darlehn oder Hypotheken,der Gewinn,Stammkapital muss 25.000 € betragen,der Gewinn,Fahrzeuge Gebäude Betriebsausstattung Grundstücke usw.
Was versteht man unter einem Kredit?,•Eigentumsvorbehalt - der Käufer bleibt so lange,Alle Unternehmer deren Firma in das Handelsregister eingetragen is,Kredit ist ein Darlehen oder einen Zahlungsaufschub (Stundung).,mbH bedeutet “mit beschränkter Haftung“,Kasse Bank Vorräte offene Forderungen Besitzwechsel usw.,Alle Unternehmer deren Firma in das Handelsregister eingetragen is,Kasse Bank Vorräte offene Forderungen Besitzwechsel usw.,Genauso wenn er selbst gefahren wäre.
Wann spricht man von Kreditwürdigkeit?,Das Vertrauen das ein Unternehmer wegen seiner Zahlungsfähigkeit genießt und aufgrund dessen ihm ein Darlehen oder ein Zahlungsaufschub bewilligt wurde.,Die Fähigkeit allen Zahlungsverpflichtungen fristgerecht nachzukommen.,Genauso wenn er selbst gefahren wäre.,Nein,• Jeder Geschäftsfähige jeder für geschäftsfähig Erklärte;,Die Fähigkeit allen Zahlungsverpflichtungen fristgerecht nachzukommen.,• Jeder Geschäftsfähige jeder für geschäftsfähig Erklärte;,der Gewinn
In welchen Fällen wird dies besonders wichtig?,Ein ungesicherter Kredit der im Vertrauen auf die Person des Schuldners gegeben wird.,Kredit ist ein Darlehen oder einen Zahlungsaufschub (Stundung).,unerlaubter Handlung,Bei der Anschaffung von neuen Fahrzeugen. (Finanzierung).,sie beginnt mit dem Schluss des Jahres in dem der Anspruch entstanden ist,Kredit ist ein Darlehen oder einen Zahlungsaufschub (Stundung).,sie beginnt mit dem Schluss des Jahres in dem der Anspruch entstanden ist,Kasse Bank Vorräte offene Forderungen Besitzwechsel usw.
Wie kann man sich die notwendigen baren Mittel für Neuanschaffungen außerdem besorgen?,Betriebsausgaben,• Abtretung von Forderungen,• das Betriebsvermögen,• Aufnahme von Krediten Darlehn oder Hypotheken,der Gewinn,Durch Sicherungsübereignung des eigenen Fahrzeugs an eine Bank oder ein sonstiges Finanzierungsinstitut.,der Gewinn,• Jeder Geschäftsfähige jeder für geschäftsfähig Erklärte;
Worauf muss man bei Raten- bzw. Kreditkäufen immer besonders achten?,Der Scheck,• Journal - Aufzeichnung sämtlicher Geschäftsvorfälle.,Fahrzeuge Gebäude Betriebsausstattung Grundstücke usw.,Auf die Höhe der zu entrichtenden Zinsen der Nebengebühren und des Disagios (Unterschied zwischen Nennbetrag und tatsächlicher Auszahlung,Kasse Bank Vorräte offene Forderungen Besitzwechsel usw.,Alle Unternehmer deren Firma in das Handelsregister eingetragen is,Kasse Bank Vorräte offene Forderungen Besitzwechsel usw.,sie beginnt mit dem Schluss des Jahres in dem der Anspruch entstanden ist
Was ist ein Personalkredit?,Ja er haftet aus Gefährdungshaftung nach StVO und aus unerlaubter Handlung.,Ein ungesicherter Kredit der im Vertrauen auf die Person des Schuldners gegeben wird,Genauso wenn er selbst gefahren wäre.,Nein,• Jeder Geschäftsfähige jeder für geschäftsfähig Erklärte;,Die Fähigkeit allen Zahlungsverpflichtungen fristgerecht nachzukommen.,• Jeder Geschäftsfähige jeder für geschäftsfähig Erklärte;,• das Betriebsvermögen
Welche Arten von Krediten gibt es nach ihrer Dauer gesehen?,letzung von Leben Gesundheit Eigentum oder sonstigen Rechts vom Unternehmer Schadensersatz verlangen,Durch Sicherungsübereignung des eigenen Fahrzeugs an eine Bank oder ein sonstiges Finanzierungsinstitut.,• Langfristige Kredite: Hypothekenkredit Anleihe- oder Obligationskredit (oft unkündbar),Bargeldlose Zahlung erfolgt durch Scheck Wechsel Überweisung oder im Lastschriftverfahren,• Kurzfristige Kredite: Kontokorrent- Wechselkredit.,Kredit ist ein Darlehen oder einen Zahlungsaufschub (Stundung).,sie beginnt mit dem Schluss des Jahres in dem der Anspruch entstanden ist,Fahrzeuge Gebäude Betriebsausstattung Grundstücke usw.
Wie kann ein TuM-Unternehmer seine Forderungen auf einfache Weise durchsetzen?,Stammkapital muss 25.000 € betragen,Indem er einen Mahnbescheid erwirkt.,• Abtretung von Forderungen,• sich eines Bürgen zu bedienen.,• Aufnahme von Krediten Darlehn oder Hypotheken,Betriebsausgaben,• das Betriebsvermögen,Genauso wenn er selbst gefahren wäre.
Was muss beachtet werden wenn dem TuM-Unternehmer Mahnbescheid zugestellt wird?,Alle Unternehmer deren Firma in das Handelsregister eingetragen is,Ein- und Ausgabebuchführung.,• Journal - Aufzeichnung sämtlicher Geschäftsvorfälle.,Er muss innerhalb der im Mahnbescheid angegebenen Frist (2 Wochen ab Zustellung) Widerspruch bei dem den Mahnbescheid erlassenden Amtsgericht erheben.,mbH bedeutet “mit beschränkter Haftung“,Der Scheck,Fahrzeuge Gebäude Betriebsausstattung Grundstücke usw.,unerlaubter Handlung